	alamat	judul	
1564	https://indeks.kompas.com/?site=nasional&date=2021-9-21&page=5	Saat Jokowi Jadi Sopir Luhut, Puan, dan Erick Thohir...	
1565	https://indeks.kompas.com/?site=nasional&date=2021-9-21&page=5	Polri: Irjen Napoleon Dibantu Eks Anggota FPI Maman Suryadi Aniaya Muhammad Kece	
1566	https://indeks.kompas.com/?site=nasional&date=2021-9-21&page=5	Periksa Kepala BPKD DKI, KPK Dalami Penyertaan Modal Daerah untuk Pengadaan Lahan di Munjul	
1567	https://indeks.kompas.com/?site=nasional&date=2021-9-21&page=5	Jokowi: Kebutuhan Baja dalam Negeri Sangat Besar, Jangan Biarkan Dimasuki Produk Luar Negeri	
1568	https://indeks.kompas.com/?site=nasional&date=2021-9-21&page=5	Mayoritas Perempuan, Guru PAUD Salah Satu Kelompok Terdampak Parah Pandemi Covid-19	
1569	https://indeks.kompas.com/?site=nasional&date=2021-9-21&page=5	Komnas HAM Harap Bertemu Jokowi untuk Jelaskan Rekomendasi Terkait TWK Pegawai KPK	
1570	https://indeks.kompas.com/?site=nasional&date=2021-9-21&page=5	DPR Sahkan Tujuh Calon Hakim Agung Hasil Uji Kelayakan 	
1571	https://indeks.kompas.com/?site=nasional&date=2021-9-21&page=5	Guru Besar Ilmu Hukum Universitas Airlangga JE Sahetapy Tutup Usia	
1572	https://indeks.kompas.com/?site=nasional&date=2021-9-21&page=5	Ini Daftar Aktivitas di Jawa-Bali dan Luar Jawa-Bali yang Wajib Pakai Aplikasi PeduliLindungi	
1573	https://indeks.kompas.com/?site=nasional&date=2021-9-21&page=5	KSAL: Calon Komandan Harus Berani Ambil Risiko	
1574	https://indeks.kompas.com/?site=nasional&date=2021-9-21&page=5	PMI: Donor Darah Menurun Setiap Terjadi Lonjakan Kasus Covid-19 	
1575	https://indeks.kompas.com/?site=nasional&date=2021-9-21&page=5	Diduga Tak Penuhi Syarat, Nyoman Suryadnyana Disahkan DPR  Jadi Anggota BPK 2021-2026	
1576	https://indeks.kompas.com/?site=nasional&date=2021-9-22&page=1	KPK Sita Uang Rp 225 Juta dalam OTT Bupati Kolaka Timur	
1577	https://indeks.kompas.com/?site=nasional&date=2021-9-22&page=1	KPK Beberkan Kronologi OTT Bupati Kolaka Timur	
1578	https://indeks.kompas.com/?site=nasional&date=2021-9-22&page=1	KPK: Bupati Kolaka Timur Diduga Minta Uang Rp 250 Juta ke Kepala BPBD sebagai Fee Proyek Jembatan	
1579	https://indeks.kompas.com/?site=nasional&date=2021-9-22&page=1	KPK Tahan Bupati Andi Merya Nur dan Kepala BPBD Kolaka Timur	
1580	https://indeks.kompas.com/?site=nasional&date=2021-9-22&page=1	KPU Sebut Pencoblosan Pemilu 2024 di Bulan April Akan Problematik	
1581	https://indeks.kompas.com/?site=nasional&date=2021-9-22&page=1	KPK Tetapkan Bupati Kolaka Timur Andi Merya Nur dan Kepala BPBD Tersangka Suap	
1582	https://indeks.kompas.com/?site=nasional&date=2021-9-22&page=1	Anggaran Bansos 2022 Rp 74,08 Triliun, Risma: Bansos Tidak Dihentikan	
1583	https://indeks.kompas.com/?site=nasional&date=2021-9-22&page=1	Kejagung: Alex Noerdin Perintahkan Pencairan Dana Hibah Pembangunan Masjid Sriwijaya Tanpa Proposal	
1584	https://indeks.kompas.com/?site=nasional&date=2021-9-22&page=1	Komnas HAM Gali Kesaksian 3 Pegawai KPI Terkait Dugaan Pelecehan Seksual	
1585	https://indeks.kompas.com/?site=nasional&date=2021-9-22&page=1	2 Eks Pejabat Diten Pajak Didakwa Terima Suap Rp 57 Miliar Rekayasa Laporan	
1586	https://indeks.kompas.com/?site=nasional&date=2021-9-22&page=1	Rapat dengan Kemenlu, Pimpinan Komisi I Sebut Tak Ada Tambahan Anggaran pada 2022	
1587	https://indeks.kompas.com/?site=nasional&date=2021-9-22&page=1	Kasus Pembangunan Masjid Sriwijaya yang Libatkan Alex Noerdin Diduga Rugikan Negara Rp 130 Miliar	
1588	https://indeks.kompas.com/?site=nasional&date=2021-9-22&page=1	Ke Lampung, Panglima TNI Perintahkan Habiskan Semua Dosis Vaksin Covid-19	
1589	https://indeks.kompas.com/?site=nasional&date=2021-9-22&page=1	Kemenkes: Varian Delta Virus Corona Mendominasi di 34 Provinsi	
1590	https://indeks.kompas.com/?site=nasional&date=2021-9-22&page=1	Alex Noerdin Kembali Jadi Tersangka Kasus Korupsi, Kali Ini Terkait Pembangunan Masjid	
1591	https://indeks.kompas.com/?site=nasional&date=2021-9-22&page=2	WHO Ingatkan RI Belum Keluar dari Bahaya Covid-19 meski Kasus Turun	
1592	https://indeks.kompas.com/?site=nasional&date=2021-9-22&page=2	Bupati Kolaka Timur Andi Merya Nur dan Kepala BPBD yang Terjaring OTT Tiba di KPK	
1593	https://indeks.kompas.com/?site=nasional&date=2021-9-22&page=2	Kemenkes Minta Pemda Capai Target 60 Persen Vaksinasi Dosis Pertama untuk Lansia	
1594	https://indeks.kompas.com/?site=nasional&date=2021-9-22&page=2	Kuasa Hukum Sebut Kritik Fatia Ditujukan terhadap Luhut sebagai Pejabat Publik	
1595	https://indeks.kompas.com/?site=nasional&date=2021-9-22&page=2	Kemenkes: Mobilitas di 4 Provinsi Ini Naik Seperti Sebelum Pandemi	
1596	https://indeks.kompas.com/?site=nasional&date=2021-9-22&page=2	Luhut dan Moeldoko, Para Pejabat yang Laporkan Aktivis ke Polisi...	
1597	https://indeks.kompas.com/?site=nasional&date=2021-9-22&page=2	Dilaporkan Luhut, Kuasa Hukum Fatia Sebut yang Disampaikan Kliennya Bukan Pencemaran Nama Baik 	
1598	https://indeks.kompas.com/?site=nasional&date=2021-9-22&page=2	Kemenkes: Kasus Kematian Covid-19 Turun 48 Persen Sepekan Terakhir	
1599	https://indeks.kompas.com/?site=nasional&date=2021-9-22&page=2	Akses Konten Negatif Terkait SARA Diputus, Menkominfo: Tak Ada Ruang bagi Penista Agama	
1600	https://indeks.kompas.com/?site=nasional&date=2021-9-22&page=2	TNI AL Bangun 2 Kapal Rumah Sakit untuk Penanganan Covid-19	
1601	https://indeks.kompas.com/?site=nasional&date=2021-9-22&page=2	Wapres: Sektor Utama Halal Value Chain Produk Indonesia Tumbuh Positif Meski Pandemi	
1602	https://indeks.kompas.com/?site=nasional&date=2021-9-22&page=2	Usai Diperiksa Terkait Dugaan Penganiayaan Muhammad Kece, Irjen Napoleon Diisolasi	
1603	https://indeks.kompas.com/?site=nasional&date=2021-9-22&page=2	Polisikan Haris Azhar dan Fatia, Luhut: Siapa Pun Boleh Kritik Selama Pakai Data yang Bisa Diuji	
1604	https://indeks.kompas.com/?site=nasional&date=2021-9-22&page=2	OTT di Kolaka Timur, KPK Amankan 6 Orang Termasuk Bupati dan Kepala BPBD	
1605	https://indeks.kompas.com/?site=nasional&date=2021-9-22&page=2	UPDATE: Capaian Vaksinasi Covid-19 Dosis Kedua Capai 22,33 Persen 	
1606	https://indeks.kompas.com/?site=nasional&date=2021-9-22&page=3	Kemenkominfo Putus Akses terhadap 2,6 Juta Konten Negatif, Terbanyak Pornografi	
1607	https://indeks.kompas.com/?site=nasional&date=2021-9-22&page=3	UPDATE 22 April: Ada 49.662 Kasus Aktif Covid-19 di Indonesia	
1608	https://indeks.kompas.com/?site=nasional&date=2021-9-22&page=3	UPDATE 22 September: Sebaran 2.720 Kasus Baru Covid-19, Tertinggi di Jatim	
1609	https://indeks.kompas.com/?site=nasional&date=2021-9-22&page=3	Haris Azhar Sempat Kirim Undangan Pertemuan, tapi Luhut Tidak Datang	
1610	https://indeks.kompas.com/?site=nasional&date=2021-9-22&page=3	UPDATE 22 September: 256.163 Spesimen Diperiksa, Positivity Rate dengan PCR 5,24 Persen	
1611	https://indeks.kompas.com/?site=nasional&date=2021-9-22&page=3	Airlangga: Arahan Presiden, 50 Persen Vaksin Covid-19 Didistribusikan Dinkes, Sisanya oleh Polri-TNI	
1612	https://indeks.kompas.com/?site=nasional&date=2021-9-22&page=3	UPDATE 22 September: Ada 373.201 Suspek Terkait Covid-19 di Indonesia	
1613	https://indeks.kompas.com/?site=nasional&date=2021-9-22&page=3	Terima Masukan dari Banyak Kiai, Ketua GP Ansor Dukung PBNU Gelar Muktamar pada Tahun 2021	
1614	https://indeks.kompas.com/?site=nasional&date=2021-9-22&page=3	UPDATE: Bertambah 5.356, Total Kasus Sembuh dari Covid-19 Kini 4.008.062	
1615	https://indeks.kompas.com/?site=nasional&date=2021-9-22&page=3	Berhentikan Pegawai Tanpa Pesangon, Pimpinan KPK Dinilai Tak Berniat Jalankan Putusan MK	
1616	https://indeks.kompas.com/?site=nasional&date=2021-9-22&page=3	UPDATE: Bertambah 149, Kasus Kematian akibat Covid-19 Kini 140.954 Jiwa	
1617	https://indeks.kompas.com/?site=nasional&date=2021-9-22&page=3	UPDATE: Bertambah 2.720, Kasus Covid-19 di Indonesia Capai 4.198.678	
1618	https://indeks.kompas.com/?site=nasional&date=2021-9-22&page=3	Presiden Jokowi Dijadwalkan Hadir secara Virtual dalam Covid-19 Summit Malam Ini	
1619	https://indeks.kompas.com/?site=nasional&date=2021-9-22&page=3	Aplikasi PeduliLindungi Digunakan untuk Skrining PON XX	
1620	https://indeks.kompas.com/?site=nasional&date=2021-9-22&page=3	HQR Code Sertifikat Vaksin Tak Terbaca di Saudi, Kemenkes: Masih Proses Integrasi	
1621	https://indeks.kompas.com/?site=nasional&date=2021-9-22&page=4	Laporkan Haris Azhar dan Fatia, Luhut: Kebebasan Berpendapat Harus Beretika	
1622	https://indeks.kompas.com/?site=nasional&date=2021-9-22&page=4	Anggota Komisi I Minta Kemenkominfo Segera Tutup Konten Penghinaan Agama dan Ras di Internet	
1623	https://indeks.kompas.com/?site=nasional&date=2021-9-22&page=4	Laporkan Haris dan Fatia atas Dugaan Pencemaran Nama Baik, Luhut Dinilai Tak Beriktikad Baik	
1624	https://indeks.kompas.com/?site=nasional&date=2021-9-22&page=4	Haris Azhar Dilaporkan Luhut, Kuasa Hukum: Klien Kami Akan Selalu Bersikap Kesatria	
1625	https://indeks.kompas.com/?site=nasional&date=2021-9-22&page=4	KJRI: Booster Vaksin Covid-19 Jadi Syarat Mutlak Masuk Arab Saudi	
1626	https://indeks.kompas.com/?site=nasional&date=2021-9-22&page=4	Jokowi Sebut TWK Tak Boleh Merugikan, tetapi 56 Pegawai KPK Dipecat Tanpa Pesangon	
1627	https://indeks.kompas.com/?site=nasional&date=2021-9-22&page=4	Politisi PDI-P Sebut Ada Pihak yang Dorong RI Gabung AUKUS Terkait Laut China Selatan	
1628	https://indeks.kompas.com/?site=nasional&date=2021-9-22&page=4	Kuasa Hukum Sesalkan Langkah Luhut Laporkan Haris Azhar dan Fatia ke Polisi	
1629	https://indeks.kompas.com/?site=nasional&date=2021-9-22&page=4	Hasil Survei: Ada 12,3 Responden Tak Puas dengan Proses Vaksinasi, Paling Banyak Keluhkan Antrean	
1630	https://indeks.kompas.com/?site=nasional&date=2021-9-22&page=4	Jokowi: Banyak Konflik Agraria Berlangsung Sangat Lama, 40 Tahun Tak Selesai	
1631	https://indeks.kompas.com/?site=nasional&date=2021-9-22&page=4	Jokowi: Vaksin dan Protokol Kesehatan Jadi Kunci Pengendalian Covid-19	
1632	https://indeks.kompas.com/?site=nasional&date=2021-9-22&page=4	Hasil Survei: 2,3 Persen Responden Dapat Vaksin Booster, 0,2 Persen Bukan Nakes	
1633	https://indeks.kompas.com/?site=nasional&date=2021-9-22&page=4	Pemerintah Siapkan Dua Kawasan Industri Halal di NTB	
1634	https://indeks.kompas.com/?site=nasional&date=2021-9-22&page=4	KPK Geledah 5 Lokasi di Hulu Sungai Utara Terkait Dugaan Suap	
1635	https://indeks.kompas.com/?site=nasional&date=2021-9-22&page=4	"Jokowi: Jangan Ada Penegak Hukum yang ""Back Up"" Mafia Tanah"	
1636	https://indeks.kompas.com/?site=nasional&date=2021-9-22&page=5	Luhut Laporkan Haris Azhar dan Fatia, LBH Jakarta: Mestinya Klarifikasi, Bukan Kriminalisasi	
1637	https://indeks.kompas.com/?site=nasional&date=2021-9-22&page=5	Puan Minta Sekolah Tak Curi Start Pertemuan Tatap Muka, Keselamatan Murid Prioritas	
1638	https://indeks.kompas.com/?site=nasional&date=2021-9-22&page=5	Periksa Sekda Probolinggo, KPK Dalami Pemberian Uang dari ASN untuk Jabat Kades	
1639	https://indeks.kompas.com/?site=nasional&date=2021-9-22&page=5	Jokowi Bagikan 124.120 Sertifikat Tanah Hasil Penyelesaian Konflik Agraria	
1640	https://indeks.kompas.com/?site=nasional&date=2021-9-22&page=5	BNPB Kirimkan 3 Juta Masker untuk Menunjang Kegiatan PON XX	
1641	https://indeks.kompas.com/?site=nasional&date=2021-9-22&page=5	Empat Hal Ini Jadi Fokus Kemenlu Upayakan Perdamaian-Keamanan Kawasan Tahun 2022	
1642	https://indeks.kompas.com/?site=nasional&date=2021-9-22&page=5	Jaksa Agung Minta Perangkat Digital Terkait Fungsi Intelijen Aman dan Tidak Bocor	
1643	https://indeks.kompas.com/?site=nasional&date=2021-9-22&page=5	Selesaikan Kasus Pelecehan di KPI, Kepolisian Sebut Punya Semangat yang Sama dengan Komnas HAM	
1644	https://indeks.kompas.com/?site=nasional&date=2021-9-22&page=5	Pamerkan Data Covid-19 Indonesia Membaik, Menlu Retno Harap Arab Saudi Tinjau Kebijakan Vaksin dan Umrah	
1645	https://indeks.kompas.com/?site=nasional&date=2021-9-22&page=5	Komnas HAM Gali Keterangan Kepolisian Terkait Kasus Dugaan Perundungan dan Pelecehan Seksual Pegawai KPI	
1646	https://indeks.kompas.com/?site=nasional&date=2021-9-22&page=5	Kementerian PPPA: Perlu Dibuat Solusi Atasi Masalah Lansia	
1647	https://indeks.kompas.com/?site=nasional&date=2021-9-22&page=5	Luhut Melapor ke Polda Metro Jaya, Jubir: Pak Luhut Datang sebagai Warga Biasa, Bukan Pejabat	
1648	https://indeks.kompas.com/?site=nasional&date=2021-9-22&page=5	OTT di Kolaka Timur, KPK Tangkap Bupati Andi Merya Nur	
1649	https://indeks.kompas.com/?site=nasional&date=2021-9-22&page=5	Pemerintah Bakal Tetapkan Cuti Bersama dan Libur Nasional 2022 dengan Pertimbangkan Perkembangan Covid-19	
1650	https://indeks.kompas.com/?site=nasional&date=2021-9-22&page=5	Wali Kota Nonaktif Tanjungbalai M Syahrial Divonis 2 Tahun Penjara, KPK Nyatakan Pikir-pikir	
1651	https://indeks.kompas.com/?site=nasional&date=2021-9-23&page=1	Ketua DPR Minta Pemerintah Percepat Vaksinasi Covid-19	
1652	https://indeks.kompas.com/?site=nasional&date=2021-9-23&page=1	Jumhur Hidayat Dituntut 3 Tahun Penjara, Kuasa Hukum Keberatan JPU Tak Sertakan Keterangan Saksi	
1653	https://indeks.kompas.com/?site=nasional&date=2021-9-23&page=1	Kasus Dugaan Penyebaran Hoaks, Jumhur Hidayat Dituntut 3 Tahun Penjara	
1654	https://indeks.kompas.com/?site=nasional&date=2021-9-23&page=1	"Kubu Moeldoko Uji Materi AD/ART, Demokrat: Cari Pembenaran ""Begal Politik"""	
1655	https://indeks.kompas.com/?site=nasional&date=2021-9-23&page=1	KSAU Pimpin Sertijab Danseskoau hingga Pangkoopsau III	
1656	https://indeks.kompas.com/?site=nasional&date=2021-9-23&page=1	Yusril Jadi Kuasa Hukum Kubu Moeldoko Ajukan Uji Materi AD/ART Demokrat ke MA	
1657	https://indeks.kompas.com/?site=nasional&date=2021-9-23&page=1	Panglima TNI, Kapolri, dan Ketua DPR Hadiri Bakti Sosial Alumni Akabri 1996 di Tangerang	
1658	https://indeks.kompas.com/?site=nasional&date=2021-9-23&page=1	Satgas: Jika Ada Kasus Positif Covid-19, Segera Tutup Sekolah	
1659	https://indeks.kompas.com/?site=nasional&date=2021-9-23&page=1	Forum Pemred Sahkan Kepengurusan Baru, Arfin Asydhad Ketua	
1660	https://indeks.kompas.com/?site=nasional&date=2021-9-23&page=1	Prof Sahetapy dan Kisah-kisah Anggota Dewan yang Terhormat 	
1661	https://indeks.kompas.com/?site=nasional&date=2021-9-23&page=1	Cegah Insiden Serupa Penganiayaan Muhammad Kece Terulang, Polri Perketat Pengamanan Rutan	
1662	https://indeks.kompas.com/?site=nasional&date=2021-9-23&page=1	Mengacu BPOM, Penggunaan Vaksin Pfizer Belum Diperbolehkan untuk Anak di Bawah 12 Tahun	
1663	https://indeks.kompas.com/?site=nasional&date=2021-9-23&page=1	PBB, Berkarya, dan Perindo Ajukan Uji Materi Pasal tentang Verifikasi Parpol UU Pemilu ke MK	
1664	https://indeks.kompas.com/?site=nasional&date=2021-9-23&page=1	Laporan Luhut terhadap Fatia dan Haris Azhar Dinilai Berkebalikan dengan Pernyataan Jokowi	
1665	https://indeks.kompas.com/?site=nasional&date=2021-9-23&page=1	Polri Dalami Dugaan Irjen Napoleon Aniaya Muhammad Kece, 18 Saksi Diperiksa	
1666	https://indeks.kompas.com/?site=nasional&date=2021-9-23&page=2	Satgas: Ada 2,77 Persen Sekolah yang Timbulkan Klaster Covid-19 Selama PTM Terbatas	
1667	https://indeks.kompas.com/?site=nasional&date=2021-9-23&page=2	Komnas HAM Minta Pejabat Publik Tahan Diri Hadapi Kritik	
1668	https://indeks.kompas.com/?site=nasional&date=2021-9-23&page=2	Jokowi Ajak Masyarakat Lestarikan Penyu, Populasinya Kian Menurun	
1669	https://indeks.kompas.com/?site=nasional&date=2021-9-23&page=2	Irjen Napoleon Bonaparte Kembali Jadi Tersangka, Kini Kasus TPPU	
1670	https://indeks.kompas.com/?site=nasional&date=2021-9-23&page=2	Diisukan Duet dengan Anies di Pilpres 2024, Sandiaga Uno: Saya Fokus untuk Parekraf	
1671	https://indeks.kompas.com/?site=nasional&date=2021-9-23&page=2	Pemerintah Percepat Capaian Kepemilikan Akta Kelahiran Anak	
1672	https://indeks.kompas.com/?site=nasional&date=2021-9-23&page=2	Azis Syamsuddin Dikabarkan Berstatus Tersangka, Golkar Hargai Proses Hukum di KPK	
1673	https://indeks.kompas.com/?site=nasional&date=2021-9-23&page=2	20 Tersangka Kasus Peredaran Uang Palsu Ditangkap, Polisi: Ada yang Residivis	
1674	https://indeks.kompas.com/?site=nasional&date=2021-9-23&page=2	Komisi VIII DPR Ingatkan Perlunya Mitigasi jika Ada Siswa atau Guru Positif Covid-19	
1675	https://indeks.kompas.com/?site=nasional&date=2021-9-23&page=2	Sebaran 160 Kasus Kematian akibat Covid-19, Tertinggi di Aceh	
1676	https://indeks.kompas.com/?site=nasional&date=2021-9-23&page=2	Menduga di Jabar, Polisi Dalami Lokasi Pembuatan Uang Palsu Dollar AS 	
1677	https://indeks.kompas.com/?site=nasional&date=2021-9-23&page=2	Menurut KPU, Hal Ini Harus Diperbaiki untuk Cegah KPPS Meninggal Saat Pemilu 2024	
1678	https://indeks.kompas.com/?site=nasional&date=2021-9-23&page=2	Lewat Program Pejuang Muda, Mensos Ajak Mahasiswa â€œBacaâ€ Masa Depan	
1679	https://indeks.kompas.com/?site=nasional&date=2021-9-23&page=2	UPDATE: 46.980.347 Juta Orang Sudah Divaksinasi Covid-19 Dosis Kedua	
1680	https://indeks.kompas.com/?site=nasional&date=2021-9-23&page=2	"Kemenkes Sebut Mayoritas Nakes Pakai Moderna ketimbang AstraZeneca sebagai Vaksin ""Booster"""	
1681	https://indeks.kompas.com/?site=nasional&date=2021-9-23&page=3	UPDATE 23 September: Ada 353.860 Suspek Terkait Covid-19 di Indonesia	
1682	https://indeks.kompas.com/?site=nasional&date=2021-9-23&page=3	UPDATE 23 September: 47.997 Kasus Aktif Covid-19 di Indonesia	
1683	https://indeks.kompas.com/?site=nasional&date=2021-9-23&page=3	UPDATE: Tambah 248.125, Total Spesimen Covid-19 yang Diperiksa 37.348.941	
1684	https://indeks.kompas.com/?site=nasional&date=2021-9-23&page=3	UPDATE 23 September: Kasus Sembuh Covid-19 Tambah 4.386, Total Jadi 4.012.448	
1685	https://indeks.kompas.com/?site=nasional&date=2021-9-23&page=3	Kepada Pelajar, Jokowi: Vaksin Covid-19 Ini Jadi Rebutan 220 Negara 	
1686	https://indeks.kompas.com/?site=nasional&date=2021-9-23&page=3	UPDATE: Tambah 160, Total Kasus Kematian akibat Covid-19 Kini 141.114 Jiwa	
1687	https://indeks.kompas.com/?site=nasional&date=2021-9-23&page=3	Wakil Ketua DPR Azis Syamsuddin Jadi Tersangka? Ini Kata KPK	
1688	https://indeks.kompas.com/?site=nasional&date=2021-9-23&page=3	Jokowi: Meski Sudah Divaksin Harus Tetap Patuh Prokes, Pakai Masker	
1689	https://indeks.kompas.com/?site=nasional&date=2021-9-23&page=3	UPDATE: Tambah 2.881, Kasus Covid-19 di Indonesia Capai 4.201.559	
1690	https://indeks.kompas.com/?site=nasional&date=2021-9-23&page=3	Sekjen Gerindra Bertemu Ketua Umum PP Muhammadiyah, Ini yang Dibahas	
1691	https://indeks.kompas.com/?site=nasional&date=2021-9-23&page=3	Kemenkes Sebut Produksi Vaksin Merah Putih agar RI Tak Bergantung pada Impor	
1692	https://indeks.kompas.com/?site=nasional&date=2021-9-23&page=3	Wapres Ma'ruf Amin Minta Program Pendidikan Tinggi Adopsi Konteks Lokal	
1693	https://indeks.kompas.com/?site=nasional&date=2021-9-23&page=3	Bareskrim Polri Tangkap 20 Tersangka Kasus Peredaran Uang Palsu	
1694	https://indeks.kompas.com/?site=nasional&date=2021-9-23&page=3	KPU: Kita Nyaris Tidak Punya Tradisi Persiapkan Pemilu dengan Baik dan Matang	
1695	https://indeks.kompas.com/?site=nasional&date=2021-9-23&page=3	Nadiem Sebut Banyak Formasi Kosong Seleksi Guru PPPK di Daerah-daerah Terpencil	
1696	https://indeks.kompas.com/?site=nasional&date=2021-9-23&page=4	KPK Periksa Saksi di 4 Daerah Terkait Dugaan Korupsi Penanganan Perkara di Lampung Tengah 	
1697	https://indeks.kompas.com/?site=nasional&date=2021-9-23&page=4	"Pastikan Pemerintah Perkuat 3T dan Vaksinasi, Menkes: ""Insya Allah"" Kita Hidup Normal"	
1698	https://indeks.kompas.com/?site=nasional&date=2021-9-23&page=4	Wapres Optimistis Tak Ada Lagi Kemiskinan Ekstrem pada 2024 	
1699	https://indeks.kompas.com/?site=nasional&date=2021-9-23&page=4	KPK Usut Dugaan Korupsi Terkait Penanganan Perkara di Lampung Tengah	
1700	https://indeks.kompas.com/?site=nasional&date=2021-9-23&page=4	Penjelasan Kemenkes soal Klaim Vaksin Pfizer Aman untuk Anak 5-11 Tahun	
1701	https://indeks.kompas.com/?site=nasional&date=2021-9-23&page=4	Ini Penjelasan BPN Bogor soal Sengketa Lahan PT Sentul City Tbk Vs Rocky Gerung	
1702	https://indeks.kompas.com/?site=nasional&date=2021-9-23&page=4	Kontras Nilai Fatia Maulidiyanti dan Haris Azhar Mestinya Dilindungi, Bukan Dilaporkan 	
1703	https://indeks.kompas.com/?site=nasional&date=2021-9-23&page=4	Anggota Komisi I Prediksi Surpres Calon Panglima TNI Dikirim Usai PON XX	
1704	https://indeks.kompas.com/?site=nasional&date=2021-9-23&page=4	Indonesia Segera Kirim Bantuan Kemanusiaan untuk Myanmar Bulan Ini	
1705	https://indeks.kompas.com/?site=nasional&date=2021-9-23&page=4	Jokowi: Rehabilitasi Mangrove Harus Kita Lakukan untuk Antisipasi Perubahan Iklim	
1706	https://indeks.kompas.com/?site=nasional&date=2021-9-23&page=4	Indonesia Bebas Zona Merah Covid-19, Epidemiolog: Krisis Pandemi Belum Berakhir	
1707	https://indeks.kompas.com/?site=nasional&date=2021-9-23&page=4	Soal Pon XX Papua, Satgas: Penonton Maksimal 25 Persen dan Terapkan Sistem Gelembung 	
1708	https://indeks.kompas.com/?site=nasional&date=2021-9-23&page=4	Penanganan Covid-19 Riau Membaik, Panglima TNI: Terus Cermati Perkembangan dan Fakta di Lapangan	
1709	https://indeks.kompas.com/?site=nasional&date=2021-9-23&page=4	Wapres Akui Masyarakat Miskin Bertambah akibat Covid-19	
1710	https://indeks.kompas.com/?site=nasional&date=2021-9-23&page=4	Jokowi Janji Terus Bangun Pelabuhan hingga Tol Laut 	
1711	https://indeks.kompas.com/?site=nasional&date=2021-9-23&page=5	QR Code Sertifikat Vaksin Tak Terbaca di Arab Saudi, Kemenkes: Kita Coba Selesaikan	
1712	https://indeks.kompas.com/?site=nasional&date=2021-9-23&page=5	Jokowi: Laut Harus Kita Jaga untuk Kepentingan Generasi Sekarang dan yang Akan Datang	
1713	https://indeks.kompas.com/?site=nasional&date=2021-9-23&page=5	Menhan dan Panglima TNI Tak Hadir, Rapat Komisi I Diwarnai Interupsi	
1714	https://indeks.kompas.com/?site=nasional&date=2021-9-23&page=5	Kemendikbud Ristek Minta Pansel Tunda Pengumuman Seleksi Guru PPPK	
1715	https://indeks.kompas.com/?site=nasional&date=2021-9-23&page=5	Nadiem Klaim Dengar Aspirasi Masyarakat untuk Beri Afirmasi bagi Guru Honorer	
1716	https://indeks.kompas.com/?site=nasional&date=2021-9-23&page=5	KPK Eksekusi Mantan Mensos Juliari Batubara ke Lapas Kelas I Tangerang	
1717	https://indeks.kompas.com/?site=nasional&date=2021-9-23&page=5	Ketua MUI: Masih Ada Warga yang Menolak Vaksin Covid-19	
1718	https://indeks.kompas.com/?site=nasional&date=2021-9-23&page=5	Menkes Prediksi Pandemi Paling Cepat Selesai 5 Tahun	
1719	https://indeks.kompas.com/?site=nasional&date=2021-9-23&page=5	Kemenpora: Presiden Jokowi Akan Buka PON Papua 2 Oktober 2021	
1720	https://indeks.kompas.com/?site=nasional&date=2021-9-23&page=5	Pemerintah Diminta Waspadai Lonjakan Kasus Covid-19 di Asia Tenggara	
1721	https://indeks.kompas.com/?site=nasional&date=2021-9-23&page=5	"Luhut Vs Haris Azhar dan Fatia Kontras, Berawal dari Tudingan ""Bermain"" Tambang di Papua"	
1722	https://indeks.kompas.com/?site=nasional&date=2021-9-23&page=5	KPK Periksa Sekda sebagai Saksi Dugaan Suap Pengadaan Barang di Kabupaten Hulu Sungai Utara	
1723	https://indeks.kompas.com/?site=nasional&date=2021-9-23&page=5	Wapres Dorong Percepatan Vaksinasi Covid-19 bagi Lansia	
1724	https://indeks.kompas.com/?site=nasional&date=2021-9-23&page=5	Bertemu Dubes Arab Saudi, Kemenag Lobi agar Jemaah Indonesia Bisa Umrah	
1725	https://indeks.kompas.com/?site=nasional&date=2021-9-23&page=5	ICW Sebut Sejumlah Alasan Jokowi Harus Bersikap Terkait Polemik TWK Pegawai KPK 	
1726	https://indeks.kompas.com/?site=nasional&date=2021-9-24&page=1	Susunan Pengurus Partai Keadilan dan Persatuan Periode 2021-2026	
1727	https://indeks.kompas.com/?site=nasional&date=2021-9-24&page=1	Mendagri Minta Daerah Siapkan Skenario Penanganan Lonjakan Kasus Covid-19	
1728	https://indeks.kompas.com/?site=nasional&date=2021-9-24&page=1	Langkah Kubu Moeldoko Uji Materi AD/ART Demokrat Dinilai Tak Etis	
1729	https://indeks.kompas.com/?site=nasional&date=2021-9-24&page=1	Jokowi: Semoga Pelantikan Pengurus Jadi Momentum Energi Baru untuk PKP	
1730	https://indeks.kompas.com/?site=nasional&date=2021-9-24&page=1	Atlet Paralimpiade Indonesia Berjaya di Tokyo, Ini Janji Mensos untuk Mereka	
1731	https://indeks.kompas.com/?site=nasional&date=2021-9-24&page=1	Oktober, Fitur PeduliLindungi Ada di Gojek, Tokopedia, hingga Jaki	
1732	https://indeks.kompas.com/?site=nasional&date=2021-9-24&page=1	Wakil Ketua DPR Azis Syamsuddin Dijemput KPK, MKD: Di Luar Dugaan Kami	
1733	https://indeks.kompas.com/?site=nasional&date=2021-9-24&page=1	Wapres Ingatkan Revisi UU ASN Jangan Sampai Lemahkan Reformasi Birokrasi	
1734	https://indeks.kompas.com/?site=nasional&date=2021-9-24&page=1	Kuasa Hukum ICW dan Fatia Datangi Komnas HAM, Minta Perlindungan Pekerja HAM	
1735	https://indeks.kompas.com/?site=nasional&date=2021-9-24&page=1	Dijemput Penyidik KPK, Azis Syamsuddin Tiba di Gedung Merah Putih	
1736	https://indeks.kompas.com/?site=nasional&date=2021-9-24&page=1	Puan: Vaksin Kita Banyak, Jangan Sampai Tidak Disuntikkan	
1737	https://indeks.kompas.com/?site=nasional&date=2021-9-24&page=1	Ketua KPK: Azis Syamsuddin Sudah Dibawa ke Gedung KPK	
1738	https://indeks.kompas.com/?site=nasional&date=2021-9-24&page=1	Kemenkes: Hampir 9.000.000 Orang yang Gunakan PeduliLindungi 	
1739	https://indeks.kompas.com/?site=nasional&date=2021-9-24&page=1	Epidemiolog Sebut Masih Banyak Masyarakat di Papua Percaya Covid-19 dari Roh Jahat	
1740	https://indeks.kompas.com/?site=nasional&date=2021-9-24&page=1	Beri Apresiasi Atlet Paralimpiade, Mensos Risma Janji Bangun Tempat Latihan	
1741	https://indeks.kompas.com/?site=nasional&date=2021-9-24&page=2	KTP Dinilai Bisa Jadi Alternatif agar Warga Bisa Beraktivitas meski Tak Punya Aplikasi PeduliLindungi	
1742	https://indeks.kompas.com/?site=nasional&date=2021-9-24&page=2	KPK Geledah 3 Lokasi di Probolinggo Terkait Dugaan Suap Jual Beli Jabatan	
